### ISSUE TITLE
redis 认证扫描结果输出问题

### ISSUE THREAD

**Issue by xmlijhu** [shadow1ng/fscan#447]
扫描结果没有正确显示，虽然有正确的password，但是没有显示。
从靶机的tcpdump可以看到已经找到正确的password了，但是没有在扫描机上显示出来。 

**扫描机**

# ./fscan -m redis -h 10.10.10.13:6379 -pwdf pass 
┌──────────────────────────────────────────────┐
│    ___                              _        │
│   / _ \     ___  ___ _ __ __ _  ___| | __    │
│  / /_\/____/ __|/ __| '__/ _` |/ __| |/ /    │
│ / /_\\_____\__ \ (__| | | (_| | (__|   <     │
│ \____/     |___/\___|_|  \__,_|\___|_|\_\    │
└──────────────────────────────────────────────┘
      Fscan Version: 2.0.0

[2025-03-05 12:31:23] [INFO] 读取文件成功 pass: 2 行
[2025-03-05 12:31:23] [INFO] 从文件加载密码: 2 个
[2025-03-05 12:31:24] [INFO] 暴力破解线程数: 1
[2025-03-05 12:31:24] [INFO] 开始信息扫描
[2025-03-05 12:31:24] [INFO] 已解析主机端口组合,端口设置为: 6379
[2025-03-05 12:31:24] [INFO] 最终有效主机数量: 1
[2025-03-05 12:31:24] [INFO] 开始主机扫描
[2025-03-05 12:31:24] [INFO] 有效端口数量: 1
[2025-03-05 12:31:24] [SUCCESS] 端口开放 10.10.10.13:6379
[2025-03-05 12:31:29] [SUCCESS] 服务识别 10.10.10.13:6379 => [redis] Banner:[-NOAUTH Authentication required..]
[2025-03-05 12:31:29] [INFO] 存活端口数量: 1
[2025-03-05 12:31:29] [INFO] 开始漏洞扫描
[2025-03-05 12:31:29] [INFO] 加载的插件: redis
**[2025-03-05 12:31:33] [SUCCESS] 扫描已完成: 1/1**

**靶机：tcpdump**
12:31:30.603592 IP 10.10.10.8.19336 > 10.10.10.13.6379: Flags [S], seq 2149333180, win 62727, options [mss 8961,sackOK,TS val 2165779257 ecr 0,nop,wscale 7], length 0
12:31:30.603631 IP 10.10.10.13.6379 > 10.10.10.8.19332: Flags [F.], seq 35, ack 8, win 210, options [nop,nop,TS val 987743910 ecr 2165779257], length 0
12:31:30.603631 IP 10.10.10.13.6379 > 10.10.10.8.19336: Flags [S.], seq 4145243907, ack 2149333181, win 26847, options [mss 8961,sackOK,TS val 987743910 ecr 2165779257,nop,wscale 7], length 0
12:31:30.603782 IP 10.10.10.8.19332 > 10.10.10.13.6379: Flags [.], ack 36, win 491, options [nop,nop,TS val 2165779257 ecr 987743910], length 0
12:31:30.603895 IP 10.10.10.8.19336 > 10.10.10.13.6379: Flags [.], ack 1, win 491, options [nop,nop,TS val 2165779257 ecr 987743910], length 0
**12:31:30.603919 IP 10.10.10.8.19336 > 10.10.10.13.6379: Flags [P.], seq 1:19, ack 1, win 491, options [nop,nop,TS val 2165779257 ecr 987743910], length 18: RESP "auth Password123"
12:31:30.603926 IP 10.10.10.13.6379 > 10.10.10.8.19336: Flags [.], ack 19, win 210, options [nop,nop,TS val 987743910 ecr 2165779257], length 0
12:31:30.604048 IP 10.10.10.13.6379 > 10.10.10.8.19336: Flags [P.], seq 1:6, ack 19, win 210, options [nop,nop,TS val 987743910 ecr 2165779257], length 5: RESP "OK"**

**Comment by xmlijhu** [comment]
这个发现是timeout的问题，默认的timeout 3秒是整个扫描时间，不是一个连接user/pass时间，如果调整time就可以了

**Comment by ZacharyZcR** [comment]
收到，将尽快修复

**Comment by ZacharyZcR** [comment]
已经修复
